{
  "run_id": "RUN-20260528-001",
  "work_package_id": "WP-2026W22-002",
  "agent": "implementation",
  "agent_profile": "agents/profiles/implementation_agent.yaml",
  "started_at": "2026-05-28T07:45:54+09:00",
  "ended_at": "2026-05-28T07:45:54+09:00",
  "status": "completed",
  "tool_calls": [
    {
      "tool_name": "Codex shell",
      "purpose": "Re-run the Slice 3 smoke test after Godot 4.x CLI setup.",
      "inputs": [
        "work_packages/active/WP-2026W22-002.json",
        "runs/RUN-20260527-002.json",
        "reviews/RV-20260527-002.json",
        "scripts/smoke_test.sh"
      ],
      "outputs": [
        "runs/RUN-20260528-001.json"
      ],
      "evidence": [
        "Godot 4.6.3.stable.official.7d41c59c4",
        "scripts/smoke_test.sh exit code 0"
      ]
    }
  ],
  "artifacts": [
    "game/project.godot",
    "game/scenes/main.tscn",
    "game/scripts/player.gd",
    "scripts/build_game.sh",
    "scripts/smoke_test.sh",
    "runs/RUN-20260528-001.json"
  ],
  "commands": [
    {
      "command": "godot --version",
      "exit_code": 0,
      "notes": "Godot 4.6.3.stable.official.7d41c59c4 is available at /opt/homebrew/bin/godot."
    },
    {
      "command": "scripts/smoke_test.sh",
      "exit_code": 0,
      "notes": "The tiny Godot project loads successfully in headless mode."
    }
  ],
  "scope_report": {
    "touched_paths": [
      "runs/RUN-20260528-001.json"
    ],
    "target_violations": [],
    "forbidden_change_violations": []
  },
  "notes": "This follow-up verification Run unblocks the prior Godot CLI environment blocker without changing game files."
}

