{
  "run_id": "RUN-20260528-004",
  "work_package_id": "WP-2026W22-005",
  "agent": "implementation",
  "agent_profile": "agents/profiles/implementation_agent.yaml",
  "started_at": "2026-05-28T15:37:02+09:00",
  "ended_at": "2026-05-28T15:37:30+09:00",
  "status": "completed",
  "tool_calls": [
    {
      "tool_name": "Codex shell",
      "purpose": "Confirm repository sync state, inspect WP-2026W22-005, and read the current Godot movement toy before implementation.",
      "inputs": [
        "work_packages/active/WP-2026W22-005.json",
        "owner_reviews/OR-2026W22-001-placeholder-readability-KR.md",
        "art_notes/AN-2026W22-001-placeholder-readability.md",
        "research_notes/RN-2026W22-001-placeholder-movement-toy.md",
        "game/scenes/main.tscn",
        "game/scripts/player.gd"
      ],
      "outputs": [
        "game/scenes/main.tscn",
        "game/scripts/player.gd",
        "runs/RUN-20260528-004.json"
      ],
      "evidence": [
        "HEAD, main, and origin/main were c5b3739430fa4ed5982945f764b530fc26c76711 before implementation",
        "owner_reviews/OR-2026W22-001-placeholder-readability-KR.md contained Decision: approve",
        "WP-2026W22-005 allowed only game/scenes/main.tscn, game/scripts/player.gd, and runs/RUN-20260528-004.json for this run"
      ]
    },
    {
      "tool_name": "Codex apply_patch",
      "purpose": "Add approved placeholder readability cues without assets or gameplay expansion.",
      "inputs": [
        "WP-2026W22-005",
        "AN-2026W22-001 placeholder visual direction",
        "OR-2026W22-001 approve decision"
      ],
      "outputs": [
        "Two built-in ColorRect reference lines in game/scenes/main.tscn",
        "One built-in ColorRect HeadingCue child under Player",
        "Small script update that moves HeadingCue toward the latest non-zero input direction"
      ],
      "evidence": [
        "No imported assets were added",
        "No collision, gravity, jump, camera, animation system, export, CI, or gameplay mechanic expansion was added"
      ]
    }
  ],
  "artifacts": [
    "game/scenes/main.tscn",
    "game/scripts/player.gd",
    "runs/RUN-20260528-004.json"
  ],
  "commands": [
    {
      "command": "git fetch origin --prune && git status --short --branch -uall && git remote -v && git rev-parse HEAD main origin/main && git log -1 --format=%H origin/main",
      "exit_code": 0,
      "notes": "Remote was https://github.com/lbk0523/HaLucyBros.git; main and origin/main were synchronized at c5b3739430fa4ed5982945f764b530fc26c76711."
    },
    {
      "command": "rg -n \"Decision: approve\" owner_reviews/OR-2026W22-001-placeholder-readability-KR.md",
      "exit_code": 0,
      "notes": "Owner approval was recorded at line 126."
    },
    {
      "command": "scripts/smoke_test.sh",
      "exit_code": 0,
      "notes": "Initial smoke run printed a GDScript parse error even though the command returned 0. The output was treated as failed evidence and the script typing was fixed before final verification."
    },
    {
      "command": "scripts/smoke_test.sh",
      "exit_code": 0,
      "notes": "Final smoke run printed only the Godot version banner and no script parse errors."
    },
    {
      "command": "bash -lc 'out=$(scripts/smoke_test.sh 2>&1); printf \"%s\\n\" \"$out\"; ! grep -E \"SCRIPT ERROR|ERROR:\" <<< \"$out\"'",
      "exit_code": 0,
      "notes": "Confirmed smoke-test output contains no SCRIPT ERROR or ERROR lines."
    },
    {
      "command": "npx --yes ajv-cli@5.0.0 validate --spec=draft2020 --strict=false -s schemas/run.schema.json -d runs/RUN-20260528-004.json",
      "exit_code": 0,
      "notes": "RUN-20260528-004 validated against the Run schema. AJV ignored date-time formats because no format plugin is bundled, matching existing project validation practice."
    },
    {
      "command": "npx --yes ajv-cli@5.0.0 validate --spec=draft2020 --strict=false -s schemas/work_package.schema.json -d work_packages/active/WP-2026W22-005.json",
      "exit_code": 0,
      "notes": "WP-2026W22-005 validated against the Work Package schema. AJV ignored the date format because no format plugin is bundled, matching existing project validation practice."
    },
    {
      "command": "bash -lc 'extra=$(git status --porcelain=v1 -uall | sed \"s/^...//\" | grep -Ev \"^(art_notes/AN-2026W22-001-placeholder-readability.md|owner_reviews/OR-2026W22-001-placeholder-readability-KR.md|owner_reviews/OWNER_REVIEW_BRIEF_RULES_KR.md|research_notes/RN-2026W22-001-placeholder-movement-toy.md|runs/RUN-20260528-002.json|runs/RUN-20260528-003.json|runs/RUN-20260528-004.json|work_packages/active/WP-2026W22-003.json|work_packages/active/WP-2026W22-004.json|work_packages/active/WP-2026W22-005.json|game/scenes/main.tscn|game/scripts/player.gd)$\" || true); test -z \"$extra\"'",
      "exit_code": 0,
      "notes": "Changed paths were limited to expected Phase 1 research, art, owner review, work package, implementation, and run artifacts."
    }
  ],
  "scope_report": {
    "touched_paths": [
      "game/scenes/main.tscn",
      "game/scripts/player.gd",
      "runs/RUN-20260528-004.json"
    ],
    "target_violations": [],
    "forbidden_change_violations": []
  },
  "notes": "Implementation added only placeholder readability cues approved by BK: two built-in ColorRect reference lines in the scene and one HeadingCue ColorRect under the player, with script logic to position the cue toward the latest non-zero movement direction. The player remains placeholder geometry. No assets, final sprites, final concept, animation system, collision, gravity, jump, camera, export, CI, market report, or Learning Card promotion were introduced."
}
