{
  "run_id": "RUN-20260711-005",
  "work_package_id": "WP-2026W28-044",
  "agent": "implementation",
  "agent_profile": "agents/profiles/implementation_agent.yaml",
  "started_at": "2026-07-11T07:49:00+09:00",
  "ended_at": "2026-07-11T08:06:35+09:00",
  "status": "completed",
  "tool_calls": [
    {
      "tool_name": "Two-axis review remediation",
      "purpose": "Resolve the standards and spec findings from the post-implementation parallel review.",
      "inputs": [
        "Standards finding: approved-art baseline commit authority and RUN-20260710-001 touched-path reporting were unclear.",
        "Spec finding: state-transition QA did not prove input-driven route reachability.",
        "Spec finding: configured scales did not prove Player > Goal > Hazard = Item hierarchy."
      ],
      "outputs": [
        "work_packages/active/WP-2026W28-040.json",
        "runs/RUN-20260710-001.json",
        "game/scenes/main.tscn",
        "game/tests/qa_phase4b_traversal.gd"
      ],
      "evidence": [
        "WP-040 now records b33cd5a as a post-approval implementation prerequisite, outside WP-039 generation execution.",
        "RUN-20260710-001 now lists WP-039 in touched_paths.",
        "A durable live-scene traversal test uses real ui_right/ui_accept events and no player teleport.",
        "Scene scale metrics now satisfy Player area > Goal area > Hazard area > Item area, with equal hazard/item height."
      ]
    },
    {
      "tool_name": "Godot input-driven traversal",
      "purpose": "Prove the multi-section route is reachable and the hazard is winnable through actual controls and physics.",
      "inputs": [
        "game/tests/qa_phase4b_traversal.gd",
        "res://scenes/main.tscn"
      ],
      "outputs": [
        "Input-only SUCCESS route with item collected and 17.98 seconds remaining."
      ],
      "evidence": [
        "Initial two-jump attempts failed at the hazard and demonstrated that the elevated platform is part of the required route rather than an optional decoration.",
        "The final controller climbs the warmup step at x=244.36/y=291, lands on the elevated platform at x=466.55/y=245.93, jumps the hazard, collects the item, and reaches SUCCESS at x=1030.22.",
        "The script never assigns player.position/global_position and never invokes internal collection or finish methods."
      ]
    },
    {
      "tool_name": "Godot rendered-frame inspection",
      "purpose": "Verify the adjusted scene-scale hierarchy using actual macOS OpenGL rendering.",
      "inputs": [
        "game/scenes/main.tscn",
        "game/assets/phase4b/direct_art_v2/*.png"
      ],
      "outputs": [
        "/private/tmp/halucy_wp044_preview00000001.png",
        "/private/tmp/halucy_wp040_right_view.png"
      ],
      "evidence": [
        "The player is now the largest saturated foreground read.",
        "The goal remains a tall but narrower second-priority landmark.",
        "Hazard and item have equal rendered height and a lower tier; the hazard backing wash was reduced to avoid overpowering the goal.",
        "The single background remains lowest contrast."
      ]
    }
  ],
  "artifacts": [
    "work_packages/active/WP-2026W28-044.json",
    "work_packages/active/WP-2026W28-040.json",
    "runs/RUN-20260710-001.json",
    "game/scenes/main.tscn",
    "game/tests/qa_phase4b_traversal.gd",
    "game/tests/qa_phase4b_traversal.gd.uid",
    "runs/RUN-20260711-005.json"
  ],
  "commands": [
    {
      "command": "godot --headless --path game --script res://tests/qa_phase4b_traversal.gd",
      "exit_code": 1,
      "notes": "Early input-driven attempts proved a naive two-jump path hits the hazard because the elevated platform must be used. These failures improved the test route without changing gameplay or layout."
    },
    {
      "command": "godot --headless --path game --script res://tests/qa_phase4b_traversal.gd",
      "exit_code": 0,
      "notes": "Final durable route used three real jumps, collected the item, crossed the hazard, and reached SUCCESS with 17.98 seconds remaining."
    },
    {
      "command": "Visual hierarchy metric assertion",
      "exit_code": 0,
      "notes": "Rendered sizes: player 51.24x79.49, goal 38.16x76.79, hazard 48.04x50.57, item 32.50x50.57. Area order and equal hazard/item height pass."
    },
    {
      "command": "godot --headless --path game --script /private/tmp/halucy_wp041_runtime_qa.gd",
      "exit_code": 0,
      "notes": "Full state-transition and hazard-retry regression remains green."
    },
    {
      "command": "godot --headless --path game --import; smoke and main-scene clean-output guards",
      "exit_code": 0,
      "notes": "Import, smoke, and headless runtime pass after scale adjustment and durable test addition."
    },
    {
      "command": "AJV validation for WP-040, WP-044, and RUN-20260710-001",
      "exit_code": 0,
      "notes": "Updated authority/audit artifacts and rework contract validate."
    },
    {
      "command": "Protected game script/assets/project diff and git diff --check guards",
      "exit_code": 0,
      "notes": "No gameplay script, asset, project setting, collision, or level-layout change occurred."
    }
  ],
  "scope_report": {
    "touched_paths": [
      "work_packages/active/WP-2026W28-044.json",
      "work_packages/active/WP-2026W28-040.json",
      "runs/RUN-20260710-001.json",
      "game/scenes/main.tscn",
      "game/tests/qa_phase4b_traversal.gd",
      "game/tests/qa_phase4b_traversal.gd.uid",
      "runs/RUN-20260711-005.json"
    ],
    "target_violations": [],
    "forbidden_change_violations": []
  },
  "notes": "WP-044 closes the two-axis review findings with durable evidence. Real input and physics now prove the intended multi-section route is reachable and the hazard is winnable. Configured dimensions and fresh rendered frames support the required visual hierarchy. Audit metadata now distinguishes the no-commit WP-039 generation phase from the later owner-approved WP-040 implementation baseline commit. Gameplay logic, collision, layout, assets, and production status remain unchanged."
}
