{
  "run_id": "RUN-20260613-002",
  "work_package_id": "WP-2026W22-032",
  "agent": "art",
  "agent_profile": "agents/profiles/art_agent.yaml",
  "started_at": "2026-06-13T18:52:19+09:00",
  "ended_at": "2026-06-13T19:02:00+09:00",
  "status": "completed",
  "tool_calls": [
    {
      "tool_name": "Codex shell",
      "purpose": "Inspect Art Agent profile, Phase 4B Research note, WP-032 plan, Phase 3E prepared manifest, existing prepared assets, and current dirty state before creating the Phase 4B art package.",
      "inputs": [
        "agents/profiles/art_agent.yaml",
        "research_notes/RN-2026W22-003-phase4b-complex-prototype-reference.md",
        "plans/PHASE4B_COMPLEX_PROTOTYPE_VALIDATION_PLAN.md",
        "work_packages/active/WP-2026W22-032.json",
        "art_candidates/phase3e/prepared_manifest.json",
        "art_candidates/phase3e/prepared_manifest.csv",
        "art_candidates/phase3e/prepared_preview.png"
      ],
      "outputs": [
        "art_candidates/phase4b/asset_requirements.json",
        "art_candidates/phase4b/asset_requirements.csv",
        "art_candidates/phase4b/asset_manifest.json",
        "art_candidates/phase4b/asset_manifest.csv",
        "art_candidates/phase4b/reuse_preview.md",
        "art_notes/AN-2026W22-006-phase4b-art-requirements-candidate-package.md",
        "runs/RUN-20260613-002.json"
      ],
      "evidence": [
        "Preflight confirmed the Phase 4B art package outputs and RUN-20260613-002 did not already exist.",
        "sips recorded existing Phase 3E prepared asset dimensions without modifying images."
      ]
    },
    {
      "tool_name": "Codex structured authoring",
      "purpose": "Map Phase 4B gameplay-readable asset roles to existing Phase 3E prepared candidates or explicit reuse gaps.",
      "inputs": [
        "Phase 4B Research note asset-role constraints",
        "Phase 3E prepared asset manifest",
        "Phase 4B scope brief"
      ],
      "outputs": [
        "asset requirements JSON/CSV",
        "asset manifest JSON/CSV",
        "reuse preview Markdown",
        "Art note"
      ],
      "evidence": [
        "Hazard maps to existing obstacle with readability risk.",
        "Collectible records no clear reuse candidate.",
        "Goal maps to existing goal marker as recommended reuse candidate.",
        "Section landmark maps to existing floor/platform with collision alignment risk."
      ]
    },
    {
      "tool_name": "apply_patch",
      "purpose": "Create the bounded Phase 4B Art requirements, manifest, preview, Art note, Work Package, and Run artifacts without mutating forbidden surfaces.",
      "inputs": [
        "WP-032",
        "Phase 4B Research note",
        "Phase 3E prepared manifest"
      ],
      "outputs": [
        "art_candidates/phase4b/asset_requirements.json",
        "art_candidates/phase4b/asset_requirements.csv",
        "art_candidates/phase4b/asset_manifest.json",
        "art_candidates/phase4b/asset_manifest.csv",
        "art_candidates/phase4b/reuse_preview.md",
        "art_notes/AN-2026W22-006-phase4b-art-requirements-candidate-package.md",
        "work_packages/active/WP-2026W22-032.json",
        "runs/RUN-20260613-002.json"
      ],
      "evidence": [
        "No new image generation was performed.",
        "No binary assets, Godot files, owner review artifacts, QA reviews, Learning Cards, lifecycle moves, staging, commit, or push were created."
      ]
    }
  ],
  "artifacts": [
    "art_candidates/phase4b/asset_requirements.json",
    "art_candidates/phase4b/asset_requirements.csv",
    "art_candidates/phase4b/asset_manifest.json",
    "art_candidates/phase4b/asset_manifest.csv",
    "art_candidates/phase4b/reuse_preview.md",
    "art_notes/AN-2026W22-006-phase4b-art-requirements-candidate-package.md",
    "work_packages/active/WP-2026W22-032.json",
    "runs/RUN-20260613-002.json"
  ],
  "commands": [
    {
      "command": "date '+%Y-%m-%dT%H:%M:%S%z'",
      "exit_code": 0,
      "notes": "Recorded the local run start timestamp as 2026-06-13T18:52:19+0900."
    },
    {
      "command": "test -e art_candidates/phase4b/asset_requirements.json; test -e runs/RUN-20260613-002.json",
      "exit_code": 1,
      "notes": "Preflight confirmed the Phase 4B requirements JSON and Run record did not already exist."
    },
    {
      "command": "sips -g pixelWidth -g pixelHeight art_candidates/phase3e/prepared/*.png art_candidates/phase3e/prepared_preview.png",
      "exit_code": 0,
      "notes": "Recorded existing prepared asset dimensions: floor/platform 427x161, goal marker 194x267, obstacle 199x242, player 199x223, prepared preview 960x220."
    },
    {
      "command": "jq empty art_candidates/phase4b/asset_requirements.json art_candidates/phase4b/asset_manifest.json",
      "exit_code": 0,
      "notes": "Structured Phase 4B asset requirements and manifest parse as JSON."
    },
    {
      "command": "python3 - <<'PY'\nimport csv\nfor path in ['art_candidates/phase4b/asset_requirements.csv','art_candidates/phase4b/asset_manifest.csv']:\n    with open(path, newline='') as f:\n        rows = list(csv.DictReader(f))\n    assert rows, path\n    assert 'required_asset_id' in rows[0], path\nprint('csv ok')\nPY",
      "exit_code": 0,
      "notes": "CSV review surfaces parse and include required_asset_id."
    },
    {
      "command": "rg -n \"required_asset_id|candidate_id|existing_source_path|reuse_decision|owner_review_status|implementation_handoff_note|hazard|collectible|goal|section_landmark\" art_candidates/phase4b/asset_requirements.json art_candidates/phase4b/asset_manifest.json art_candidates/phase4b/reuse_preview.md",
      "exit_code": 0,
      "notes": "Coverage check confirmed required fields and Phase 4B roles are present."
    },
    {
      "command": "npx --yes ajv-cli@5.0.0 validate --spec=draft2020 --strict=false -s schemas/work_package.schema.json -d work_packages/active/WP-2026W22-032.json",
      "exit_code": 0,
      "notes": "WP-032 validates against the Work Package schema. AJV ignored the date format because no format plugin is bundled, matching existing project validation practice."
    },
    {
      "command": "npx --yes ajv-cli@5.0.0 validate --spec=draft2020 --strict=false -s schemas/run.schema.json -d runs/RUN-20260613-002.json",
      "exit_code": 0,
      "notes": "RUN-20260613-002 validates against the Run schema. AJV ignored date-time formats because no format plugin is bundled, matching existing project validation practice."
    },
    {
      "command": "bash -lc 'extra=$(git status --short --untracked-files=all | sed \"s/^...//\" | grep -Ev \"^(AGENTS.md|research_notes/RN-2026W22-003-phase4b-complex-prototype-reference.md|work_packages/active/WP-2026W22-031.json|runs/RUN-20260613-001.json|art_candidates/phase4b/asset_requirements.json|art_candidates/phase4b/asset_requirements.csv|art_candidates/phase4b/asset_manifest.json|art_candidates/phase4b/asset_manifest.csv|art_candidates/phase4b/reuse_preview.md|art_notes/AN-2026W22-006-phase4b-art-requirements-candidate-package.md|work_packages/active/WP-2026W22-032.json|runs/RUN-20260613-002.json)$\" || true); test -z \"$extra\"'",
      "exit_code": 0,
      "notes": "Changed-file scope is limited to the pre-existing AGENTS.md change, prior WP-031 artifacts, and WP-032-authorized artifacts."
    }
  ],
  "scope_report": {
    "touched_paths": [
      "art_candidates/phase4b/asset_requirements.json",
      "art_candidates/phase4b/asset_requirements.csv",
      "art_candidates/phase4b/asset_manifest.json",
      "art_candidates/phase4b/asset_manifest.csv",
      "art_candidates/phase4b/reuse_preview.md",
      "art_notes/AN-2026W22-006-phase4b-art-requirements-candidate-package.md",
      "work_packages/active/WP-2026W22-032.json",
      "runs/RUN-20260613-002.json"
    ],
    "target_violations": [],
    "forbidden_change_violations": []
  },
  "notes": "Phase 4B Art Requirements And Candidate Package completed as an explicit reuse package from existing Phase 3E prepared assets. No new image generation or binary asset creation occurred. The package gives BK/Human Creative Owner reviewable decisions for hazard, collectible, goal, and section landmark roles and identifies the goal marker as the lowest-risk imported gameplay-readable candidate. This run does not authorize owner approval, Godot implementation, QA pass, Learning Card promotion, closeout, staging, committing, or pushing."
}
